{
  "schema_version": "1.0",
  "decision_id": "dec_20250108T110000Z_0001",
  "plan_id": "plan_a3f5b2c8",
  "decision_type": "DAG_REVIEW",
  "decision": "APPROVE",
  "decided_by_agent_id": "agent_dag_review_coordinator",
  "created_at": "2025-01-08T11:00:00Z",
  "subject": {
    "kind": "task_dag",
    "ref_sha256": "sha256:REPLACE_ME",
    "ref_revision": 3
  },
  "missing_participants": [
    "agent_security_manager"
  ],
  "evidence_files": [
    "dag_review_result_round3_engineering.json",
    "dag_review_result_round3_design.json",
    "dag_review_result_round3_qa.json"
  ],
  "notes": "Unified decision record for Monitor/Dashboard. Business judgement is made by coordinator agents, not by Monitor."
}
